,topic
0,Dental Caries in Children
1,Early Childhood Caries
2,Fluoride Therapy
3,Pediatric Oral Hygiene
4,Dental Sealants
5,Space Maintainers
6,Pulp Therapy in Children
7,Stainless Steel Crowns
8,Behavior Management in Pediatric Dentistry
9,Sedation in Pediatric Dentistry
10,Preventive Dentistry for Kids
11,Oral Habits in Children
12,Dental Trauma Management
13,Malocclusion in Children
14,Orthodontics for Children
15,Cleft Lip and Palate Treatment
16,Special Needs Dentistry
17,Infant Oral Health Care
18,Teething in Infants
19,Eruption Patterns in Children
20,Pediatric Oral Pathology
21,Pediatric Oral Surgery
22,Diet and Dental Health
23,Tooth Development in Children
24,Anomalies of Tooth Formation
25,Enamel Hypoplasia in Children
26,Dental Anxiety in Children
27,Nitrous Oxide Sedation
28,Conscious Sedation
29,Pediatric Endodontics
30,Growth and Development in Children
31,Pediatric Radiology
32,Dental Materials in Pediatric Dentistry
33,Oral Health Education for Kids
34,Community Dentistry Programs for Children
35,Interceptive Orthodontics
36,Temporomandibular Disorders in Children
37,Bruxism in Children
38,Oral Ulcers in Children
39,Antibiotic Prophylaxis in Pediatric Dentistry
40,Oral Health in Schools
41,Dental Emergencies in Children
42,Infant Feeding Practices and Oral Health
43,Oral Cancer Screening in Children
44,Laser Dentistry for Kids
45,Infection Control in Pediatric Dentistry
46,Plaque Control in Children
47,Gingivitis in Children
48,Periodontal Diseases in Children
49,Salivary Diagnostics in Children
50,Importance of Fluoride in Water
51,Thumb Sucking and Its Effects
52,Managing Pacifier Use in Children
53,Importance of Primary Teeth
54,Dental Checkups for Toddlers
55,Dental Crowns for Children
56,Importance of Brushing Baby Teeth
57,Silver Diamine Fluoride in Pediatric Dentistry
58,Dental Fillings for Kids
59,Cavities in Baby Teeth
60,Early Orthodontic Treatment
61,Choosing a Pediatric Dentist
62,Mouthguards for Sports
63,X-rays for Children
64,Frenectomy in Pediatric Dentistry
65,Oral Hygiene for Toddlers
66,Dental Health in Preschoolers
67,Tongue Tie in Infants
68,Palate Expansion for Children
69,Dental Abscess in Children
70,Chewing Habits in Kids
71,Orthodontic Retainers for Children
72,Teeth Grinding in Children
73,Sealants for Kids
74,Managing Dental Phobia
75,Composite Fillings for Kids
76,Sedation Safety for Kids
77,Restorative Dentistry for Children
78,Fluoride Varnish for Children
79,Teeth Whitening in Adolescents
80,Managing Overbites in Kids
81,Pediatric Root Canals
82,Growth and Facial Development in Children
83,Wisdom Teeth in Teens
84,Sports-related Dental Injuries
85,Oral Health for Preteens
86,Impact of Soda on Children's Teeth
87,Choosing Toothpaste for Children
88,Minimally Invasive Dentistry for Children
89,Preventing Cavities in Kids
90,Early Loss of Baby Teeth
91,Dental Hygiene for Teenagers
92,The Role of Calcium in Dental Health
93,Dietary Sugars and Their Effect on Teeth
94,Managing Dental Crowding in Kids
95,Teething Pain Management
96,Dental Checkups During Pregnancy
97,Prevention of Oral Disease in Infants
98,Flossing for Kids
99,Dental Wear in Children
100,Causes of Pediatric Bad Breath
